{"arguments":{"path":"DASHI/Physics/Closure/NSTriadKNCanonicalBAnalyticCutsetASTExact.agda","profile":"repo"},"commit_sha":"c6a37b3aa611361737b7b51ec355a8f079c3d087","created_at":"2026-10-18T04:11:03.352687+00:00","job_id":"accept-agda-ns-b4-004","operation":"agda_module","repository":"chboishabba/dashi_agda","requested_by":"cli","resource_class":"high_mem","schema_version":"colab_prover_job_v1","timeout_seconds":7200,"toolchain_policy":"repo_pinned"}