{"arguments":{"target":"QuantumMereology"},"commit_sha":"57795094baf0f74d4f9a67bbff946ec6998eda77","created_at":"2026-10-18T02:46:28.780142+00:00","job_id":"accept-lean-quantum-mereology-002","operation":"lake_build","repository":"chboishabba/dashi_lean4","requested_by":"cli","resource_class":"high_mem","schema_version":"colab_prover_job_v1","timeout_seconds":7200,"toolchain_policy":"repo_pinned"}