{"arguments":{"path":"DASHI/Physics/Closure/NSCanonicalB4PhysicalR440AnalyticInterfaceExact.agda","profile":"repo"},"commit_sha":"c54f826aeaadad2eedc4c9f7c438f1fa7c267658","created_at":"2026-10-17T12:00:25.630867+00:00","job_id":"accept-agda-ns-b4-001","operation":"agda_module","repository":"chboishabba/dashi_agda","requested_by":"antigravity-pair","resource_class":"high_mem","schema_version":"colab_prover_job_v1","timeout_seconds":7200,"toolchain_policy":"repo_pinned"}