{"arguments":{"path":"DASHI/Physics/Closure/NSCanonicalB4PhysicalR440AnalyticInterfaceExact.agda","profile":"repo"},"commit_sha":"e3cb609cda9ed7d55281afe32e7294589581b675","created_at":"2026-10-18T03:31:28.795071+00:00","job_id":"accept-agda-ns-b4-003","operation":"agda_module","repository":"chboishabba/dashi_agda","requested_by":"cli","resource_class":"high_mem","schema_version":"colab_prover_job_v1","timeout_seconds":7200,"toolchain_policy":"repo_pinned"}